Meditation_Type,URL,Script
nan,nan,"Today's meditation is a meditation for self-love, increasing self-esteem and self-confidence. Until this, meditation addresses are third chakra, Which is at our solar plexus, And it also addresses are 4th chakra, which is at our heart space, are a rib cage or chest. so, as you're ready That to make your way into a comfortable seated position, maybe on a chair, maybe on a cushion- Feel your spine erect straight, at ease In a position that allows you to be comfortable Yet keeps you from becoming drowsy, Take a few moments to feel the sense of your bones and muscles, really seen with gravity, into the chair beneath you, into the cushion. feel your bones and muscles dropping out of the shoulders, Elbows, wrists dropping out of the shoulders, Lower jaw releasing. Notice any sensation that might come up of tension in the body, Any pain in the lower back or pinching. Nancy, bring your awareness to parts of the body that are vying for your attention. Spring Island, non-judgmental awareness, An inquisitive about the sensation. What makes three full breasts together, Taking a full inhalation, feeling the crevices of the chest, Full relaxed exhalation, Letting the breath completely run its course. Find another inhalation feeling all the way up into the collarbones, And then a full relaxed exhalation, Relax and all the way to the end. Take another final inhalation, breathing even into the back body, Near the scapula, the shoulder, shoulder blades, Nano, full, complete exhalation, Really seen the breath completely And then allowing my words to be your words. I am at peace with myself. I appreciate the person I have grown into. I deserve to be at peace. I deserve to be happy. I embrace my feelings, my emotion. My future is bright and positive. I look forward to the future And I enjoy the present moment. I look fondly on many memories from my past. I view my shortcomings as strength not yet developed, Rather than weaknesses, and I even really develop new Strength. I imagine that all of these affirmations are true for me And even when they feel untrue, I desire them to be true. I approached challenges with strength. I desire to approach my challenges with strength. I always do the best that I can With what I've been given and a time that I have. I do not need to be perfect to be okay. as a human being, I embrace my imperfections. I accept myself wholly and completely. I care for myself wholly and completely. I take time for myself and I enjoy it. I deserve this time that I take for myself and I feel good about taking this time, regularly. I handle difficulties with Grace, challenges and obstacles With Grace. I allow myself to experience and express my emotions. I am perfect just the way. I am, 75 South. I value myself, I feel confident And if you would like to place your right hand on your chest, on your sternum, Take a few moments feeling Any feeling, the sensation of your heartbeat. You might feel the sensation of your breath moving your chest. News for a few moments, pause And witness yourself, Witness your emotions, Witness Sensations That are appearing in your mind, in your body. Enough room to yourself that i desire to love myself. Holy, completely, Using your first name. Oh, you spell the name. Jane is your first name. I love you, Jane. I desire to love you Jane, Bringing both palms to touch in front of the heart, Taking a moment, maybe, you, to set an intention. It might be an action intention, An invention, could be Intention of recommitting to yourself, to being alone with yourself, to getting to know yourself. My intention might be as simple as Reaffirming your love for yourself and that you value yourself, or that you expect, during perfection, Them prowling heather namaste."
nan,nan,"Good morning and welcome to your morning meditation. I invite you to stop. by taking some deep breaths, Breathing into the body, I'm waking up the body, Energy moving to a natural braiding pattern. That's right for you. I next invite you to bring to mind Free things that you feel grateful: soul, And this might be the bed that you're sleeping in, It might be the breath It is carried you for the nice into the day, And perhaps it's being grateful For the health of the body that you have. I just taking a moment And thinking of those three things that you feel grateful for. I just noticing If there's a shift in the way that you're feeling When you bring these things to mind. It's also a case of the same three things everyday. The setting yourself up from this place Of gratitude And centering yourself in your breast Will allow you to move. Trinidad, I can understand, But you can come back to the breast And back to this feeling of gratitude at any time Throughout the day. So as you move out into the world today, I invite you to notice, especially in any times of difficulty, You can return to these points, Just noticing the shift when you do, And you can also remind yourself of everything that you've achieved so far, Everything that you have been through so far, And remind yourself that you can overcome anything, But you need to, And that you can grow and expand And achieving ething You need to. You can always return to self And back to the understanding that nothing needs to change Beyond this moment that you're in right now. The feeling of this moment And the presents At this moment, Remembering that everything Is as it should be, Energy, move throughout the day. One thing that can make it easier Is to express compassion to others And to yourself By practicing self-compassion, Understanding that the Strange's The people you know in love And even the people that you find difficult throughout the day, Just like you. I probably waking up now, hoping For lovely day, High, paying for health and happiness, Hoping for peace and to be free from suffering. I just remembering how similar you are to others, Remembering your interconnectedness with others, Can really help you move through the day, And i invite you also to see what you might spread: some kindness, Compassion And your day today. I just remembering those things, But the breath is constant, That you always have things, that you can be grateful And that nothing needs to change beyonce's monument And that we are all connected Iohl, similar. Now heart Be healthy, At peace and free from suffering. Just returning to the breast now And centering yourself, Reminding yourself of the central point that you can come back to it anytime today, Taking another moment to be grateful for the breath, The carrying you through this meditation And for its ability to carry you through. They stay ahead of you And as you head out into the world today, remembering that everything is as it should be. Thank you and have a lovely day."
nan,nan,"You can do this visualization lying down, Ending up your sitting up. make sure your feet are on the floor And your arms are crossed, let down by your side on your lap. You can close your eyes gently, Really fill your lungs. is in the brass is coming from below your diaphragm, It only in breast. Set alarm to two or three times your normal capacity. Turn on the outbreak, really exile No damn breath. breathe in through your nose. know now press open your mouth slightly And I become aware of your thoughts. Just imagine Those that you love. Imagine the things you like doing. Imagine the things you love doing. Imagine what it would be like to live in the world Unconditional love. Imagine what it'd be like. Do a job you love to do, of your clients finding you and that just being enough work to do, The right type, the right enjoyment. And it said, when you love the work you do, you'll never work again. I put your tongue to the roof of your mouth. You just imagine a point about an inch up into inches back. It's at the top of your spinal column, is your pineal gland. Let your thoughts Wander from the front of your brain Into the center. I'm from there. just become one of the above, your thoughts for a few seconds and let your tongue relax. Emotion is the chief of light. Restarting your coccyx goes all the way up the inside of your spine, through your throat, into the base of your brain, All the way through up to the crown, the top of your head, November 1st, Nice. and the light explode from the base of your spine All the way up past your heart into your brain. Indonesian brass to get brighter and brighter. Now that your consciousness float down this column on the next town breast Past, your throat. Animation is sitting just behind your sternum and your heart center, Not much, and flowing from your heart center in both directions, but it right angles to a body Is a pool Tech And this bull text is known as your heart rate. Melanie Chopra, just imagine, to the Press gets up full text. the kick, it's been all right. NH. time you breathe out, it spins faster and faster and stronger and brighter. Now this is bryce being something we've had within us all our lives, But it's been hidden from many of us and suppress. I'm one of the reasons for its depression. is it so powerful? I'm with it. you can send unconditional love to anyone anywhere on the planet at any time, both in the present and in the past and in the future. Let's just play with your heart right now. It's very gentle and its nature Is very loving. by its nature- La Mansion, original price- he goes out further and farther. Let it spin. now It touches the heart race of all the people that you love, But past, present and those in the future you are yet to love, Unconsciously- a list, people you reached out to touch with your heart. right out of my chick dose of unconditional love, Now that Jim breast- imagine the hot rice bins back into your chest and takes a little bit of unconditional love from all those you sent it to back into your body, I noticed- now i will- the out-breath. you can send out unconditional love and only impressed. you cannot resolve it. and your hawk right is that channel, that conduit Sending love out To the heart race of all of the beings that you choose. But the heart rate is very flexible. it can be pointed downwards and outputs And I imagine it turning through 90 degrees and pointing down through the base of your spine into the ass And send unconditional love to Mother us, giving you grounding, Holding the air that you breathe, They giving you the Wolves to keep you alive. Enjoy the food that you eat And turn it the other way so it goes up for your throat 3 or pineal gland and out through your crown Into the Super consciousness. Send love out to your guides And to the source. I know now that you are an expression of unconditional love incarnated. Your Heart Center is the pivot point for what you ammonites and which it receives. I'd like hold muscles. your heart ray becomes stronger and more effective the more times it's used. You can use it as you wake up in the morning, You can use it as you go to sleep at night, You can use it in business meetings, You can use a family functions And you can send love out to future events and situations so that by the time you get that, that love is already in the air. So use it wisely, use it ethically and use it often. Tell, open your eyes, genti, and come back into the room. Go forward into the world as an expression of unconditional love."
nan,nan,"Creating a space In which you can sit or lie, Finding the position where your body is most comfortable. Are posture and Body Language one of strength and openness? You just surroundings, free from distraction, Gently closing ovia odds, allowing your attention to be drawn into what your body, Removing a source from mix Channel and arrive in completely into the present moment, calling all aspects of yourself into this space, Connecting to your breath, Consciously breathing in 309.. Exhaling through your open mouth, Entry own eyes. Exhaling out of 300, open math. Continuing the socket breath throughout the meditation until it's cell phones within your body into a natural breathing Saco. Three of mines. i visualize yourself from a bird's-eye view. Gather and understanding of what your energy looks like within this space, The shape of your energetic field, The color wheel, colors that surround you throughout your aura. Whatever you see or feel is what you are ready to shine. Invite you to connect to solar plexus chakra. This Energy Center is connected to your personal power, your self-esteem, your confidence, Vision, small glider just above your belly button, like a Tawny lot of food with Bry. This is where your solar plexus chakra is located. Turn your breath into this area and allowed and intention to course of you An intention few Sakura and expand your horizons beyond your current self, Sending this line all the way through Figlio. connection to this energy. Each breath through the lot from the solar plexus, develop and broaden. Observe the writing's building as a positive stomach shearing down into your lower abdomen, supporting all of your organs, Melting through your hips, pelvis and genitals, Cleansing and clearing, shift stagnant energy Stretching down to your legs, knees and finding its way down through your calves and shins. See a glowing out through your ankles and your face- What is a fuses of 3? and into your chest, Rippling through your shoulders, into- I hate feeling- this lot flood tendons, ligaments, Deep down into your butt, Since disseminating a lot, growing bigger and stronger, Connecting you to the aspects of inner strength, willpower and self-discipline that Sean from within you. This lot is the essence of you and your truest form, Drawing this love feather, diffusing it through. if you woke up, hillary's throughout your body Watches sell Rose glow, the yellow lot style oil encapsulated. Breathe deeply into that space for two large breasts. Further, extend this lot to pass through your pores, flowing out to your body's energetic field. See the energy of your personal Pala, self-esteem and confidence and fonts out into aura. Feel completely messed with in your power. Meditation is simply another word for communication, Communication with your physical and energetic and spiritual bodies Within this powerful space that you have created. Invite you to ask your higher self, Your soul. question: Question of Health, Financial matters, a new friend relationship. We're about your loss purpose on this Earth. There are no questions too large to small. Will a felon and work with us? The today's communication, Ask that you channel one question. First question: diwani drops into your Consciousness. is RTO? It would be the most connected question: wedding to Beyonce. I'll give you time to ask this question And when you do, I want you to see the words flow from you, circulate around your illuminated energetic field. Sit with these words and listen, Tapping into your intuition, your voice from within. Play soft with open to hearing, saying, feeling the answer When we are connected to Spirit. Anza Canopy Tours in many ways, Going now. Ask, Listen to receive, Gathering the conversations and gifts, Soaking up the infinite words in keeping with you. say wisdom, I say once again: visualize yourself from ever. talk to you then you're beautiful, sphere of la protection, Sacred Space that you have created for yourself. today. Does your energy, la plata, Does the color of your aura change so shifted? Does your energy look mode fiber in more dynamic. Take night these energetic changes with a new A few. love yourself this time for Stillness and healing, To this day and for all days. every way you are, Every way you visit, Every single person that you speak to, I want you to see yourself Serrano could love and lot and feel that you are always protected. I want you to know they can take this fear with you. Your Sacred Space does not have physical address. All they have to do is visualize it around you. Ask the universe. it will provide Bringing into this rested state The Deep conscious breath. Cuz your higher self to return to your physical body, Feeling your tummy, ross your chest, expand your spiritual energy into the prison realm In different time. Laugh your senses to awaken. You may start to smell and hear your surroundings coming up with of your space. You may recall your fate. your fingers Move your shoulders, roll your hips, Bring the physical touch back into your body. When you were feeling grounded, Connected back on this Earthly plane, You might open your eyes, Stop practicing to invoke your Sacred Space, whatever you maybe every day."
nan,nan,"Just guided meditation is called the compassionate body scan. it should take about 20 minutes to complete. before getting started, to find how you'd like to position yourself, you may want to sit on a chair with your back upright and get relaxed, or else on the meditation cushion, removed from want to lie on the floor with in what's known as the corpse pose in yoga. So once you get yourself situated will begin, Sister, by first getting in touch with your body, how it feels right here in the present moment. See if you can feel the weight of your seat on the cushion. I have your back on the floor. Firefield of body sensation: Any Penguins, heaviness, pressure, light in the C Mayfield. Just feel your body just as it is right now. So what we're going to be doing is moving our attention and awareness to different parts of the body, sweeping from the crown of the head down to the toes and back again, Because we go to different parts of ourselves: compassion for any pain or tension we may feel there, or perhaps for any or feelings of inadequacy we have about certain body parts, Starting with a crown of your head. Notice what Sensations are there. See if you can tune in to that. Just between your head and your skull starts McKenna. is there any trampoline or sensation? there is, so just notice it. if not, that's fine too. Become aware of your facial muscles. we have hundreds of muscles in our face and work very hard for us. express in our emotions, some of which are quite painful. these emotions He's feeling any tension or stress in any of your face, facial muscle, muscle Play, relaxing, Using them, the imaginings caressing your face with your awareness, Being grateful for how hard our face muscles work for us. Let me Where the back of your head, Any Sensations there. Do you have any sort of headache or pain? Kind, tender, compassionate to the fact that You weren't feeling perhaps as well as you'd like? If no sensation is there, just feel whatever's happening right now. New, become aware of how your neck feels: McCarran, NE Ascension, Brewing Tightness. Turn it off and holder The first four holes that are heavy head. I know it's a lot of tension, especially if we sit at the computer all day. What does relaxing the neck muscles Comforting any Points of pain may be experiencing? Dropping down into your shoulders, A lot of emotional tension. shear stress is held in our shoulders. He's almost always feel some sort of pain and tension there. The first just noticed what you feel. what is the sensation? like Hot, cold, Height, Stabbing Doll. Pick a moment to have compassion for the stress of being shoulders in your body. pickup, take on a lot. 4th, I'm just comforting any feelings of pain or discomfort you may have. I'm dropping down so that you're aware of your upper back, your shoulder blades Can feeling any tension that's are Any discomfort. Send it to be as it is: Hot, cold, Sharp, soft. Using are wearing is to acknowledge any pain. Send this to that area for our body Went to mentally imagine getting a little bit of a massage there and your shoulder blades. Let me come where of your chest area. The speed of our heart Promotions R Us in Silt felt very intensely, including difficult ones like Greece: Disappointment. Try to notice how the physical sensations of your chester manifesting. It's a sensation moving, Is it tight? Simply notice what's there, Relax around it, Comfort yourself for any pain you might be feeling in your chest. Just as a mother might cross, a child is feeling discomfort. Took the same attitude with your awareness. Assured tension on your stomach area. Youtube, A lot of difficult emotions stored here, including fear. We may have some judgments about our stomach. Maybe it's not quite as soon as we'd like it to be. Just focus on the actual sensations of your stomach. Is there any movements? maybe you're digesting food? Any tension, Any physical discomfort, The nozzle or any feelings coming out of inadequacy, Non-acceptance? Exactly she wore in this moment. Whatever arises, How to take a very calm, comforting, loving Stance towards this part of our body. we have no such difficulty with us with Maybe even Sunday, some appreciation for Very hard task of digesting your food, allowing us to be alive, Relaxing and softening, Mentoring your weirdest charger lower back. Very big muscles are Needed to keep us upright. If you feel any tension, Try to relax that part of your body, Consciously, soothe, comfort Any pains, RH. you might feel Hard to be in this human body with its limitations. We can be kind to ourselves in this moment. Dropping down tour Pelvic area Can a lot of tension off in here we don't even pay attention to. we often Avoid paying attention to this part of our body. Just notice what feelings are there. If there's any discomfort or tension, try to relax There. any emotions come up for you That are difficult Can take a very comforting approach towards this part of your body. Just allowing it to be as it is, Men dropping down to your seat itself. If you're sitting, this will be easy because you'll feel the tension of your Buttocks on the chair cushion and also if you're laying down, you feel tension there, Just noticing what feelings are there, Sending titanosaur tension Food near me that, seen this part of your body, Is there any emotional feelings associated with Perhaps not accepting this part of your body, Which I think is probably all of us Having compassion for The fact that were imperfect human beings? 6ft Nelson, open heart, Each individually. To start with your right, on the top of the shoulder blade, Top of your arm, Upper bicep. What does your upper arm on the right side feel like right now? Have big muscles are that often gets strained, lifting and told me things Sing, any tension Or discomfort? relaxing, Caressing, star Wellness, Kindly Your lower right arm. I'm strictly noticing what you feel there. Now your right wrist and fingers through hand. We have an amazing number of bones in this part of our body, especially with increasing use of computers. he's got worked over and over and over again. Could you notice too many tension there? Any feelings of discomfort? Just Comfort yourself, Have compassion for any pain you might be feeling, Since there is no discomfort, just rest and peacefulness Of being free of pain. Then shifting your attention to focus on your left Upper arm and shoulder. Noticing higher Muscles, feel Any tension, that fair, Kindly stroking your arm with your awareness, comforting yourself. Dropping down into your lower left arm, Low in the sensations to be just as they are, Your left hand Wrist, Waxing your muscles, Appreciating how hard your fingers work for you, The freedom it gives you. No, shift your focus to your right upper leg. Very big muscle here are thigh muscle. What do you feel right now in this area of your body? If you can relax a muscle, If you notice any discomfort or tension, Kylie, soothing and comforting this part of your body. The moving down to right, calf and shin, the lower part of your leg, Tearing the muscles, Saucony 910 attention. Then finally focusing on your right foot. Surprising amount of tension and stress get stored in our feet. A lot of pressure that's put on them. Big moment to appreciate your rights. How's you to walk, run, dance, Relaxing mints, many feelings of the rise, Turn yourself a mental foot massage. The movie awareness to your left leg, the upper half, the fire muscle, Saucony, nonny, tension. Send sos if i need emotional reactions. come up with non acceptance of a certain part of your body, Giving yourself compassion for that, Recognizing how hard it is to be in our competitive culture. I'm dropping down to your left lower leg, Her calf muscles, your shin, Relaxing songs, And i'm focusing on your left foot ankle, Stroller for foot, your toes. Just be aware of any Sensations that are there, tingling from pressure, Comforting any feelings of discomfort. The pain might be there. I know. why didn't your focus? so that you are aware of both feet Moving up to Both calves, Both upper legs, To your stomach, Your chess, Your neck, Your head. Just imagine, to energy flowing out the top of your head, Feeling the energy of life So Into You, Resting in weirdness of this magnificent body we have Has compassion for its pains and appreciation for its Wonder."
