Meditation_Type,URL,Script
body-scan,nan,"Lie down and get comfortable, adjusting your position as needed so you can fall asleep…and even if all you do is relax without sleeping, you will be rested and refreshed afterward. This body scan sleep relaxation will help you relax. Breathe deeply in…and slowly out… Breathe in…and slowly breathe out… Take slow, calm breaths. Feel your breathing, relax you. There is nothing you need to do right now besides breathe calmly. Just drift…relaxing. Feel yourself becoming sleepy…ever so slowly getting sleepier. Continue the body scan sleep relaxation…enjoying the body scan sleep relaxation…. See how slowly you can release the next breath you take. Breathe in deeply…and now breathe out slowly…very slowly…prolonging this breath out…relaxing…When you finish breathing out, breathe in naturally…and then breathe out again slowly. Just keep breathing now, letting each breath occur naturally, without effort, at whatever pace is comfortable for you. Feel your breathing becoming calm…slow…easy. Continue the body scan sleep relaxation…enjoying the body scan sleep relaxation…. Scan your body, beginning at the top of your head and moving downward. Turn your attention to your head. Observe Moving your attention downward to the level of your eyes, nose, chin…down to your shoulders, Noticing each area, observing how your body feels. Keep scanning gradually moving down your body. How does your upper body feel? Take note of any areas of tension Nearing the center of your body, at the level of your stomach. How is this part of your body feeling? Keep observing your physical state. Continue to scan your body, moving the focus of your attention downwards, Reaching the level of your hips…keep observing and moving your attention down. How does this part of your body feel? Notice any tension, without trying to change anything. Reaching the level of your knees…how does this area of your body feel? Keep scanning…all the way down to your feet. Take a moment now to scan your whole body, noticing how your body feels as a whole. Where is your body the most tense? Focus intently on this one area of tension…and imagine the muscles here letting go of their hold, becoming loose, becoming relaxed…letting the tension go, Releasing the tension bit by bit until this area relaxes. Feel the tension softening…feel the muscles as they loosen, lengthen…warming and relaxing, as if they are melting into relaxation. Notice where your body is the most relaxed. How does the relaxation feel? Imagine that this relaxation is warm and tingly, moving…growing…spreading to relax other parts of your body. Feel your body becoming more relaxed as the area of relaxation grows. Continue the body scan, sleep relaxation…enjoying the body scan, sleep relaxation… Allow your body to relax. Feel your shoulders relaxing, the muscles releasing their hold. Your legs are still…and they are starting to feel heavy. Your feet are very warm…feel the warmth spreading as your legs become warmer as well. Your arms are getting heavier. Feel yourself sinking into the surface you are lying on, Sinking deeper…deeper…your whole body is feeling very heavy. Feel the warmth in your hands growing warmer and warmer…spreading up to your arms. Your hands and arms are very heavy. Blink your eyes a few times if you want to Notice that your eyelids are feeling heavy. They are getting heavier and heavier, and it feels so good to close your eyes…to rest your eyes…allowing your eyes to remain closed…relaxed. Notice a feeling of coolness in your forehead: Calm, cool and relaxed, Smooth, free from tension. Imagine that the tension in your body is flowing out through your fingers and your toes, Draining away…with each breath, you can feel the tension leaving right out your finger tips and right out your toes. Feel the tension leaving your body draining away. Continue the body scan- sleep relaxation…enjoying the body scan, sleep relaxation… Let you mind drift now for a moment, just relaxing, Not needing to focus or think…just drifting as the tension continues to drain away and your body relaxes. Imagine that your body is made of caramel or chocolate or some other solid that can be melted. Right now, your body is like a solid, hard piece of caramel. Imagine a feeling of warmth starting in your hands and feet that starts to soften the caramel that your body is made of. Soon your hands and feet are soft…getting softer and more liquid. The warmth spreads throughout your body…from your hands up your arms. Feel your arms melting, softening. It is a pleasant feeling…so relaxing. Feel the warmth as it continues up from your feet up your legs. Notice your legs softening, as if they are melting to a completely relaxed state. Feel the core of your body as the warmth coming from your arms and legs meets at your stomach. Feel your core relaxing, melting. Imagine that your whole body is very soft…like caramel that has melted and is soft and stretchy. Simply rest, enjoying this relaxation, Floating…relaxing. It’s okay to just relax now…just allowing the sleep to overtake you, Letting your mind drift off…drifting…drifting back to sleep. It feels so good to surrender to the heaviness of sleep… Your body is like a feather now floating down gently toward this peaceful land of sleep. Feel your body drifting back and forth, down and down, fluttering through the air softly. Will soon be coming to rest in this peaceful place, Softly resting, sinking…a peaceful, pleasant place. So sleepy…drifting down…down… Sinking down into sleep…so deeply asleep and heavy… Pleasant…calm…dreaming… Coming to rest on a soft surface…softly sinking into comfort and sleep. There are no more words you need to focus on…just calm music. Enjoy the relaxation now…and allow yourself to drift off into pleasant deep sleep."
body-scan,nan,"Feel the connection between your body and the floor. Notice each point that connects your body to the floor. Begin to feel the heaviness of the body sinking into the floor. Now come to notice the breath. Feel the belly rise and fall. Feel the chest rise and fall. Begin to feel the lightness of the body. as you bring awareness to your breath. The body is completely relaxed, The mind is completely aware. The body is feeling light. Bring awareness to the toes. Feel the toes on the right foot. Envision your toes attached to your left foot. Left big toefourth, toethird, toesecond toepinkie toe. The left foot, The heel, The sole of the foot, The ankle, The whole of the left foot, The right foot, Right big toefourth, toethird, toesecond, toepinkie toe. The right foot, The heel, The sole of the foot, The ankle, The whole of the right foot, Both feet together. The left leg, The shin, The calf muscle, The knee, The thigh, The left buttock, The whole of the left leg, The right leg, The shin, The calf muscle, The knee, The thigh, The right buttock, The whole of the right leg. Both legs together, The hips, The lower back, The middle back, The upper back, The whole back, The whole back, The whole back. Left shoulder blade. Right shoulder blade, Left shoulder, Left upper arm, Left elbow, Left lower arm, Left wrist, Left hand, Right shoulder, Right upper arm, Right elbow, Right lower arm, Right wrist, Right hand, Both arms together. The chest, The ribs, The belly, The whole of the front body, The whole of the front body, The whole of the front body, The neck, The back of the head, The forehead, The left eyebrow, The right eyebrow, The space in between the eyebrows, The left eye, The right eye, The left cheek, The right cheek, The jaw, The tongue, The lips, The chin, The throat, The whole of the head, The whole head together, The whole body together. Feel the lightness of the whole body together. Relax and feel heavy. Sink into the floor. Relax the whole body. Relax. Feel the body connected to the floor. Feel the awareness of your body. Begin to make small movements, Open your eyes."
body-scan,nan,"Place one hand on your belly and one hand on your chest. Begin to feel the chest rise and fall. Begin to feel the belly rise and fall. Inhale, Exhale. Continue with your natural breath, feeling the air enter through your nostrils then exit through your nostrils. Continue to feel your breath. On the next inhale, feel the belly rise, then the ribs expand and finally the chest lift, coming to the top of the breath below the throat. On the exhale, the breath leaves the chest, ribs fall, belly contracts. Continue with this breath, feeling all three parts of the breath and think to yourself: belly ribs, chestchest ribs, belly. Repeat this breath three more times. With the third exhale, begin to feel the breath as a wave coming up from the belly and rising to the top of the breath beneath the throat. Hold this breath for two counts. then let the breath go in a wave from the chest out the belly. Continue with this wave-like breath rolling in and up, then counting to two and rolling out like a tide. Feel the fluidity of the breath. Feel the complete cycle of the breath. Focus only on the breath. Finish a final cycle of this breath and, after the complete exhale, return to the natural breath. Feel calmness in the breath. Feel ease and steadiness. When you are ready, open your eyes."
movement,nan,"Begin the guided energy starter by taking some deep, energizing breaths. Inhale deeply…and exhale slowly. Breathe in…and out. Breathe in again, breathing in energy…and exhale. Keep breathing deeply, slowly and calmly. With each breath, you can take in the air your body needs and become filled with energy. You can exhale any tension or fatigue you may be experiencing. For the next few moments, focus on your breathing and concentrate on breathing energy and positive feelings in, and breathing negative feelings out and away. Continue the guided energy starter…become more energized with each breath you take, Waking up…becoming wide, awake and energetic. Get ready to get up…and get moving…becoming alert and awake. Allow the energy to grow…encourage that energy…filled with energy…grow the energy…getting more and more energetic and alive. Squeeze your hands into fists and clench your fists tightly. Feel the muscles in your hands and arms…strong…tight…squeeze…and now release the fists, allowing your hands to be loose and relaxed. Allow your hands and arms to become warm and awake. Close your hands into fists…and now open them. Close and open your hands a few more times, waking up the muscles of your hands and arms. As you continue this guided energy starter, allow yourself to experience feelings of excitement and anticipation for the day ahead. Allow the energy to flow through your body…completely waking up…filled with energy…. Rub your hands together…feel the friction generated by your hands rubbing together…like electricity crackling…and increasing your energy. As you rub your hands together, it generates energy for your mind and body…leaving you feeling completely awake and alert. Move your feet up and down at the ankles, flexing the muscles on the front of your legs as you move your toes up toward your shins…hold…and then point your toes, flexing the muscles on the back of your legs. Hold…and now move your feet up again…and down…up…and down… Now move your feet quickly up and down…waking up your leg muscles…up…down…up…down…up…down… Now hold your feet still and feel a tingly energized sensation in the muscles of your legs. Place your hands on your knees and rub your hands up your legs toward your hips…then back down toward your knees. Move your hands briskly along the muscles of your thighs, generating warmth and energy. Then stop and let your hands just rest in your lap. Feel the energy in the muscles of your legs. Continue this guided energy starter as you become more awake, alert and energized, Getting ready to go. Feel your body getting ready to move…continuing the guided energy starter…wanting to move…eager to get going…continuing the guided energy starter…so filled with energy and motivation… Now continue the guided energy starter…get into a standing position with your feet shoulder width apart and your hands at your sides. Breathe in as you reach your right arm up and stretch your right hand as high into the air as you can. Breathe out as you lower your right arm to your side. Breathe in as you raise your left arm and reach as high up as you can with your left arm. Exhale as you lower your left arm to your side. Now alternate with your arms. breathing in as you raise your right arm and out as you lower your right arm. Breathe in as you raise your left arm and out as you lower your left arm. In…reach…out…relax… In…reach…out…relax… In…reach…out…relax… In…reach…out…relax… In…reach…out…relax… In…reach…out…relax… Good, Now relax your arms at your sides and stand with your eyes closed for a moment. Become aware of how your body feels. Turn your attention inward…just observing the state of your body. Feel your breathing as each breath moves in and out of your body. Feel the gentle movements your body makes as the air moves with each breath. Notice that you can feel calm and relaxed, but energized at the same time. You can encourage the energy within you to increase…becoming more and more energetic…more awake…more alert…ready to go…. Concentrate on a feeling deep inside the core of your body…a feeling of energy…of power…of motivation…excitement…. Focus intently on this feeling. You may notice it at the center of your body, near your stomach. Encourage this feeling to grow…getting bigger…and bigger… See that the energy within can grow without any effort at all…the energy so easily and naturally grows…until you feel filled with buzzing electric energy… So eager to move…movement would feel effortless… Your body feels so light…so powerful…so free… Completely filled with energy from head to toe, Ready to move…ready to think…ready to act…to do everything you need to do to fly through the day ahead. Concentrate on this feeling and allow it to grow until it is so powerful you feel unstoppable. It is a wonderful feeling to be so energized and comfortable. Now you can proceed with your day, ready to take on the day ahead, Feeling energized, alert, calm and powerful."
movement,nan,"Begin by preparing for your relaxing walk. Ensure that you have suitable clothing for the weather and are wearing supportive footwear. Standing still in one place, take a deep breath in… and exhale. Raise your arms above your head as you breathe in again… and lower your arms as you exhale. Breathe slowly, deeply and naturally. as you do a few gentle stretches. Keep your legs straight and bend forward. Place your hands on your knees. Feel the stretch in the back of your legs. Stretch further by placing your hands on your shins… reach down all the way to your ankles. if you are able, Hold this stretch Slowly. return to an upright position. Shake your right leg gently, shaking out the tension. Shake your left leg. Raise your arms out to the sides at shoulder height. Keep your arms straight out beside you. now turn your body slightly at the waist to look to the right Face. forward again. Now turn at the waist to face slightly to the left. Return to centre. Now lower your arms and shake them gently to shake out the tension. Gently stretch any areas that feel especially tense. When you are ready to proceed with your walk, go ahead and begin. Walk at whatever pace is comfortable for you- Not too slow… but not rushing either. Walk comfortably. Focus your attention on the rhythm of your steps: Left foot… right foot… left… right…. Allow this rhythm to sooth and relax you. Continue on this relaxing walk. Enjoy the movement of your body. Feel your body becoming energized as your muscles move. Feel your limbs moving. You can meditate as you walk by focusing your attention again on your footsteps. Count your steps as each foot touches the ground: One, two, three, four. one, two, three, four. one, two, three, four. one, two, three, four…. As your attention wanders, direct your focus again to your footsteps… one, two, three, four…. Continue to focus on your footsteps. Feel your energy increase with each step When each foot touches the ground. feel the energy rising all the way from your feet up through your legs… your hips… body… arms… all the way to the top of your head. The slight vibration when your foot lands on the ground serves to increase your relaxation and help you feel calm and energized. Your legs feel strong, supporting the weight of your body. Notice the slight weight shifts that allow you to walk From heel to the front of your foot and then transferring to the heel of the other foot, the front of that foot… back to the first foot…. notice these weight shifts. Notice the ever-repeating pattern of your steps. It is almost as if your feet are a wheel, rolling and rolling. One part contacts the earth while the other part is in the air. If time slowed down, you would notice that, almost imperceptibly, the weight shifts from one part of the wheel to the next, and the next and the next… until what was the bottom of the wheel is now the top. No part of the imaginary wheel… and no part of your feet… remains on the ground for long before transferring the weight to another part of your feet. Continuous motion. Continue the relaxing walk. The motion is very relaxing. Imagine the rhythm of your feet… it is like waves… flowing in and out… ever repeating…. Allow your breath to flow smoothly, also ever-repeating like waves… in… and out… in… out…. Hear the sounds of your footsteps. This is a calming and relaxing rhythm… just listening to this repeated beat. Notice all the repeated rhythms… footsteps… heartbeat… breathing… this smooth cycle of rhythms that allows you to proceed forward at a leisurely walk. Turn your attention now to your surroundings. Notice the environment around you… the surface you are walking on… the temperature… the colors… sounds… smells… enjoy your surroundings… enjoy this relaxing walk. I’ll end this script now, but you can continue to enjoy this relaxing walk for as long as you wish, feeling alert, refreshed, relaxed and invigorated."
reflection,nan,"Find a comfortable position- sitting or lying down. Notice how you are feeling right now…physically and mentally. Take a deep breath in through your nose and release the breath through your mouth. Take another breath and allow your breathing to relax you as you exhale fully. Breathe in gently… and as you breathe out, let the air carry the tension out of your body. Continue to breathe slowly and gently as you begin to focus on relaxing your body. Notice where your body is tense. Focus your attention on one of these areas As you breathe. picture that part of your body becoming slightly more relaxed than it was before. With each breath, that part of your body becomes a little more relaxed. Imagine what the relaxation feels like… tingly… soft… gentle… calm… loose… free… and let that feeling of relaxation grow. Scan your body for any areas of tension and for each area. let the relaxation soften the muscles as they give up their hold. Let the feeling of relaxation grow…spreading calm throughout your body. Breathe in relaxation… and breathe out tension…breathe in calm…and let all the tension go as you exhale…. Continue to breathe slowly and gently, deepening your state of relaxation more and more with each breath. Deeper and deeper, More and more relaxed, Calm, At peace. Now begin to create a picture in your mind. Imagine a place where you feel completely at ease. This might be a favorite place you have been or somewhere you have seen, or it might be completely imaginary. It’s up to you. Picture this place where you feel happy and calm. Create the details about this place in your mind. Visualize the sights… sounds… and smells… of your place. Imagine how you feel physically. You are comfortable, enjoying the pleasant temperature… enjoying being still and relaxing or doing whatever enjoyable activities you participate in here… Enjoy the way you feel in this safe place. You feel calm and safe here, At peace with yourself. Remain in your peaceful place while you meditate calmly and build your self-esteem. Imagine that all of the following affirmations are true for you right now, in this moment, and enjoy the self-esteem relaxation you experience. Repeat each affirmation in your mind or out loud with conviction. Use your imagination to fully believe each self-esteem relaxation affirmation. The self-esteem relaxation affirmations begin now. I am at peace with myself, I appreciate who I am, I value myself as a person, All people have value and I am a valuable human being. I deserve to relax, I deserve to be happy. I embrace my happy feelings and enjoy being content. I imagine and believe that all of these affirmations are true for me right now, in this moment, and enjoy the self-esteem relaxation I am experiencing. When my mood is low, I accept my emotions and recognize that the low mood will pass and I will be happy again. I look forward to the good times. My future is bright and positive. I look forward to the future and I enjoy the present. I look fondly upon many memories from my past. I forgive myself for my mistakes. All people make mistakes. I used to feel regret about some of my mistakes because I am a good person and want to do the best that I can. and now I am still a good person and I release the feelings of regret because I have learned and moved on. I forgive myself for errors I have made because I have felt bad about them long enough. I have suffered enough and now it is time to be free. By freeing myself from past mistakes, I can move on and do good things. I forgive myself. I imagine and believe that all of these affirmations are true for me right now, in this moment, and enjoy the self-esteem relaxation I am experiencing. I feel good about who I am today. I accept the person that I am. I accept my flaws and accept my strengths. I view my shortcomings as strengths not yet developed rather than as weaknesses. I eagerly develop new strengths. I imagine and believe that all of these affirmations are true for me right now, in this moment, and enjoy the self-esteem relaxation I am experiencing. I approach challenges with strength. I do the best that I can at the time. I give 100% effort when I am able and when I choose to put full effort toward the things that are important. I accept my imperfections and the imperfections in what I do. My efforts are good enough and they’re okay. I do not have to be perfect to be okay as a person. I am a human being with flaws. I enjoy being who I am and love myself as I am. I nurture the child within me. I feel secure in who I am and do not need to compare myself to others. All of the strengths I have ever had are present in me today. I still have the same positive character, even if not all of my strengths are shown right now. I have all of those strengths of character and will use those strengths again. I imagine and believe that all of these affirmations are true for me right now, in this moment, and enjoy the self-esteem relaxation I am experiencing. I accept myself. I care for myself. I take time for myself and enjoy it. I deserve time for myself and I feel good about taking this time regularly. I handle difficulties with grace. I allow myself to experience and express emotions, both negative and positive. I accept myself. I am perfectly alright just the way I am. I accept myself. I am a valuable human being. I accept myself. I feel confident. I accept myself. I feel secure. I accept myself. I accept myself. Think again about your peaceful place. Picture yourself enjoying this environment. Acknowledge the feelings you are experiencing. after repeating the self-esteem relaxation affirmations, Accept any positive or negative feelings you are having. Allow yourself to feel calm and at peace. Now it is time to leave your special place. Know that you can return here in your imagination any time to relax, feel calm and relaxed and feel comfortable and safe. Take with you the feelings of acceptance of yourself and belief in the self-esteem relaxation affirmations. Continue to feel positive and accepting of yourself. Hold onto this secure feeling of self-esteem as you return to your day. In a moment, I will count to 3.. If you choose to sleep, you can drift into a relaxing and pleasant sleep on the count of 3.. If you wish to become fully awake. you can increase your alertness and become energized and fully alert on the count of 3.. One… take a deep cleansing breath in… and exhale slowly. Two… take another deep breath… and exhale…. Three… you are feeling calm, confident and refreshed."
