Meditation_Type,URL,Script
nan,nan,"Is a past life guided meditation. Each time you do this meditation, you'll be taken to a different life than the one before. Give yourself time to understand the events of previous lives and how they impact on this lifetime. Let you will experience in this past life meditation you will remember in great detail You have finished listening. write it all down in your channel for future use Each time you do this past life regression. When you finish write it down, Maybe you will find similarities with the life you are living now. Maybe this will help you to understand the events that are happening in this lifetime. What type of reasons you're listening to this past life regression meditation? I hope it brings you peace And if, at any time, you feel you may want to stop this meditation, All you have to do is slowly, gently, open your eyes To find a nice, comfortable place to sit, ideally in a darkened or dimly lit room. Light a candle, if you want to, to avoid complete darkness. Take off your shoes and place your face on the floor. Lay Your Hands gently in your lap. Close your eyes. How to full. take a deep breath in through your nose. Slowly and gently read out to the count to five. Game to the counter. Deep breath in through your nose, Slowly and gently, breathing out through your mouth to the count to five. Everytime you breathe in, you breathe out all past tension. Watch it as it floats away into the distance. Noggin, Depressing to the counter. Slowly and gently, breathe out through your mouth to the count to five. Allow any sort. she might have just float away as you become more and more relaxed Skin. deep breath in through your nose Slowly, gently, raining out through your mouth, Going deeper into relaxation. One last time, depressing, Slowly and gently, breathing out through your mouth. 15 downloads: deep relaxation. I'll bring you breathing back to its normal state. relax, Just relax. a few moments, Sitting peacefully and quietly, And you feel so peaceful now, so cone, So relaxed. John legend: roots growing out from the soles of your feet, Philip, almost like the roots of a tree. I watch the series. roots go down down deep into the ground, Pushing their way into the esprillo Felis moving aside for your roots to go deeper. You can hear the sound of the soil as it moves for your roots to pass. Can you hear sound of the soil? Can You Feel the Earth moving? nice, your feet Push your roots deeper and deeper into. mother asked herself. See how she welcomes you, See how she welcomes you to be with her. Feel the loving energy she is giving you. Feel the vibrations of the earth as your roots go deeper and deeper. You can only fly as high as your roots. Now visualize of brilliant white light surrounding your whole body. What is above your head, Benicio feet. See yourself cocooned in this wonders energy. See how long, if you feel how I do, Do you feel warm and safe? Such a sit for a moment, be used in this glorious light. Feel the energy, Feel the vibrations. So peaceful now, Cellcom. So very, very relaxed. Always remember You're safe, Drawing of You are protected. always Feel your body giving up all the tension. 0, becoming more and more relaxed And more peaceful. Talking with your feet. If you have wave of relaxation flower, from the soles of your feet through to your ankles, You can feel it flowing up to your lower legs, Did to your hips. You can feel this beautiful wave of relaxation as it moves gently through your body. You can feel the muscles becoming a Lusa and softer as this wave travels. Fila wave, pure relaxation. Are you close to your pelvic area? Do your abdomen? Relaxing is so peaceful, So Feel the wave as it enters your chest, Bringing with such peace and serenity, Field flowing 3:00.. Your shoulders Feel the gentle wave of relaxation. I didn't touch your upper arms To your elbows, Down into your lower arms. Ingles, Vicente, johanns, You feel so peaceful. Feel this wave of tranquility that it contains your neck, Back of your head, The place Phoenix as it flows up to the top of your head. Your whole body is filled with his beautiful, calm oasis of serenity. Loud your entire body to feel completely at peace. Just rest, Continue breathing slowly and gently. Body feels relaxed. Your mind is clear as you go deeper and deeper into relaxation, Icey freeze. you may see images in your mind's eye. Don't try to find any meaning in them, Just simply observe them and let them drift on by. You may feel or sense things If you feel very peaceful, calm and relaxed. You realize now that you own your own private island When you can see yourself surrounded by your magical forest Place. you are safe and happy, Place that brings you absolute peace and joy, Deeply, deeply relaxed. You have never felt so much peace, So peaceful. Cellcom Safari, Relax. You look around you and see the beautiful majestic trees. You see that branches swaying gently in the breeze. You can have the beds. as I fly from tree to tree. You can hear them singing that beautiful songs. Can you hear them? Sun is shining on your face. It feels warm on your skin. Sky above the trees, the most beautiful blue that you have ever seen. Tell me a few fluffy white clouds, floating Puff. Look around you. What else do you see? Can you hear anything else? You are walking. the old familia puff. If you have worked many, many times before Ground beneath your feet, Cheap Sundays, What is it? stones and NF. You decide You are so relaxed. Selfie song, Socom. You start to walk long, miss puff. Does she? do you know she has no flowers all along one side of his. Which flowers are they Shooting down and breathing? the aromatic scent coming from each flower? Can you smell? Beautiful Aroma of the flowers, Wonderful perfume. Can you smell it? You continue to walk. When you notice there's a Fulk overhead view on yubo. When you reach his frog, You can either go left or you can go right. You decide which way you wish to go. Continue to walk on your path. Nausea. do you see movement ahead of you, Taking out from the trees? is your animal spirit guide? What kind of animal is it? PCS? Look deep into your beautiful eyes. You know that you have to follow wherever it will take you. You follow your animal spirit guide: Clearing in the forest, The edge of the clearing, I'm done. ancient oak tree Is so old that its branches are Narwhals born Amway, heavy with the knowledge that possesses. You see that this whole tree has a door in the middle. You said: Is your doll made of wood or is it made from something else? As you approach the door, it opens for you and you enter the room. at the base of the tree, You find yourself in a beautiful white room. It has a flow of black and white check tiles. The floor is covered with many different varieties of the herbs and spices. Because she walks in the room, you crush is having spices under your feet. Heidi, on a pleasure to the senses, You continue to walk to the back of the room. Will you see the flame of a violet candle burning on a plane, Ulta? Next to the Scandal is an old brass lamp. Did you pick it up, Salam of memories? With your left hand, you walk behind the altar towards the back of the room. Weather is another door waiting for you. Gain, as you approach this door is open for you, As if it knew you were coming. You were expected here today. She looks good to UCM: mist, Fog of swords. Don't be afraid, it will not harm you. She was safe and protected here. Just pulled into the Mist, does she? do you hear the door close gently behind you? Just keep on walking through the Mist If you miss a flight of stairs going down. words Can you stand at the top of the stairs and looked at him. Login to my account is this essay To walk down the stairs. Every step you take down, you will drift 10 times deeper into relaxation, Deeper and deeper into sleep like state. You feel yourself relaxing more and more. Each step you take, your feels lighter and lighter. 8. You are relaxing deeper and deeper Steph. Your whole body feels so much like in them. You can feel a wonderful worms all over your body Find. You begin to feel that your image is changing, for You notice that the mist is starting to clear now. 3. You start to catch glimpses of another landscape, Feel different If they are not. your feet, Lost, her, the mist at the bottom of the stairs. You feel completely at ease now, So peaceful, Socom, So relaxed, And everything you see, Chia and feel. you will remember and bring it back with you. Remember it, All of it. Damn that your feet. Are you wearing any shoes? Shoes all you wear. and, if any, When you rise through your body, OU, mail. What are you female? How old do you feel? What is your name? What kind of clothes do you have on? What time in history is this? What is the date? You feel very relaxed and peaceful, Deeply relaxed. Remember all of this. Now. you already are very, very slowly Turn around in a full circle, becoming aware of your surroundings. Notice if you are indoors or out. Where are you Become aware of any buildings, people, Furniture around you? If there are others around you, You can look into the eyes. You might recognize somebody that you know now, Although their appearance may be different, You will know. Is there anybody there that you recognize? How do you feel right now? You start to walk again, Moving swiftly towards your home. You were standing outside your home. now. What does it look like? What's the tip made of Und People inside? What can you see around you? Which room are you in? How do you feel right now? Be aware of your daily tasks. What is your word? Do you work? What is your profession? What is happening in your life right now? Remember this Now. move forward in time a few years. Where are you now? Who are you with? What are you doing? How old are you right now? What events are happening in your life Right now? Remember this, Still feeling very peaceful, calm and relaxed, Deeply, deeply relaxed. Allow yourself to go even deeper now, Deeper With Every Breath You Take, As you continue relaxing. take all the time you need to explore these events, Remembering all of it. I moved forward a few more years in time. Where are you now? Who are you with? What can you see around you? What are you doing? How old are you now? Notice what is happening, What is going on all around you. Become aware of the general feeling that you carried, not lifetime- How did you feel? and not lifetime. You will remember everything you see, Feel and hear about this lifetime. Not feeling so relaxed, So peaceful, Cellcom. Allow yourself to go even deeper now, So very deep. You can now approach the end of that lifetime to see, as an outside observer, how that life ended. We will do this very slowly, Uncle, to the time of your death. This is simply a part of life. There is nothing to be afraid of. there's nothing here that can hurt you in any way. You're simply going to look at it as if you were watching a television screen. Turn yourself to death. What circumstances brought about your death? What happened? What are you ill? Was it an accident Or was it just flies? Anybody there with you? Are you alone? What caused Your dad Tv experience of your death? As an outside Observer, There's nothing to be afraid of and nothing can harm you. You have experienced the end of his lifetime. What is there to learn from this experience for you? What is the meaning or objective of this lifetime? Is there anything left undone? Anything you didn't finish? What was the happiest moment for you in this lifetime? What was your saddest moment? What do you feel you are bringing back with you to help you in this lifetime? You will remember everything you say. Gia Gunn, feel Bringing it all back with you And you feel so peaceful now, so calm, So deeply, deeply relaxed. Now it's time for you to return to this lifetime, And I will now count from 1 to 10, returning you to the Here and Now. 1. You see the dual head of you. 2. At the door, open and move back into the mist. 3. Remember to carry the lamp back with you. The steps of becoming heavy and now. 5. No, beginning to become aware of noises all around you. 6. You begin to feel your own physical body again. 7. You can see the devil back into your oak tree ahead of you. Smell of the heads begin to fill your nostrils. 9. You're more aware of your own body. Send You're back in the room at the base of your oak tree, You know. return lamp to The Altar and leave walking through the white room with the hips and the spices on the floor. You woke box with you, open the hole at the base of the oak tree and you take the puff back through your magical forest Seems, flowers, trees, Even the beds. again. Take a deep breath in through your nose, Slowly and gently, let the breath out. Take another deep breath in Slowly, gently, at the Brotherhood, One last time. deep breath in, Slowly and gently. let the breath sounds Whenever you are ready, because your fingers and your toes Slowly, gently open your eyes, stretching your arms and your likes and feeling so peaceful. so I'm so deeply, deeply relaxed."
nan,nan,"This new day arrives. The sun has returned once again. My eyes now open to this first moment of light, Coming to consciousness and recognizing the familiar sound. I awaken to this moment, Connecting with the present With each breath, releasing thoughts, both the past and the future, And I allow myself to savor this present moment, Opening to this new day And resting in the return of the morning As it enters. my awareness Today is here for me. I have a purpose to fulfill in this moment That starts with a commitment to living this day with presents and focus, To see the beauty in the ordinary and receive its guests today, Remember gratitude and receive its inspiration. My awareness reminds me to live today with openness to new possibility and hope. I consciously connect with eternal life force that fills my body with energy And I decide to step into my life with courage and conviction. I can do this. I accept support to be in this moment. I am alive. Snow day awaits me."
nan,nan,"This particular practice focuses on helping you to sleep in whatever position you find yourself in, Whether you are a Seated on an airplane or bus, lying down on the floor or in the comfort of your own bed. This will be a friend to your rest, relaxation and sleep rhythms. Sleep is so essential and yet sometimes so elusive, And when we can't sleep, it can be due to physical factors, mental and emotional factors, or a combination of both. Yoga Nidra offers us tools to induce sleep organically, following the natural workings of your own mind. Notice if you could be 5 or 10% more comfortable in whatever position you've. tozen, Open your senses: Taste inside the mouth, Hearing, Listening with ears and whole body. Smell, Welcoming the touch of air and Aroma inside the nostrils. Envision Relaxing the eyes from the world of looking and seeing, Internal Vision, opening And feel the skin, the touch of air, temperature, The touch of your clothes And the touch of the ground. Now set your son Calta your intention or deep resolve for this practice. Ask yourself, In your life right now, what is your deepest, most heartfelt desire. Think of this as a little seeds that you're planting into your time in the world of sleep, Like a blessing that you sprinkle over your Passage through sleep. As you contemplate your son culpa, see and feel your life with the Fulfillment of this desire. What would your life look, sound, Smell, Taste and feel like if this deepest desire were a reality? State your son Copa three times in your own words, from your hearts, in the present tense, like a mantra. Then give thanks, Let It Go, Allow your attention to be spontaneously drawn into the breast without needing to control it or manipulated The brass breathing you. And as you relax into the Simplicity of being breathed, Notice how your body spreads like water. Feel how, within this body of water, There is a rhythm that I'd Waves of respiration ebbing and flowing. Feel how awareness of the tide of your breathing Can deepen awareness of the flow of all life. See and feel how the simple process of releasing and welcoming a quiet breath Is mirrored in the flow of a day in your life, As they closing tonight And night close in today, Touched by the transition spaces of Dawn and dusk. And see and feel how it's mirrored in the seasons of your life, As winter clothes Into Summer And summer flows into winter, Touched by the transition spaces of Autumn and spring. Relaxing into being breathed. Begin to count back On each exhalation Until you reach 0 from 10. Breast awareness at your heart, And each time you exhale, count back As though you could shed a layer or drop down a layer with each other breath. Now bring your awareness to the hollow space of your throat, The tongue, Jaws, Sensations in the gums, Teeth, Lips, The entire mouth full of sensation, Cheeks And cheekbones. 10. Ears And earlobes, Nose And tip of nose, Both nostrils, Both eyeballs And the space just underneath the eyeballs, Those eyelids full of sensation and awareness, Those eyebrows And the space between the eyebrows. Temples, Forehead, Top of the head, Back of the skull, Back of the neck, The whole head as one or both sensation. I feel both shoulders from the inside, Both upper arms, Both elbows, Four arms, Wrist, Palms of the hands, Backs of the hands, Thumbs, I can- fingers, Third fingers, Horse fingers, Pinky fingers, Fill the spaces between the fingers, The tips of the fingers, Each finger, like a little stream that flows into the space beyond. I feel the chest And the upper back, Feel the rib cage And the middle back, Philip Bailey In the low back, Elvis And the buttocks, Those hips, Sensation in the thighs, Nice, And the space just underneath the nice. Lower legs, Ankles, Scheels, Soles of the feet, Tops of the feet: Big toes, 2nd Terrace. Third toes, 4th Terrace, Pinky toes. Fill the spaces between the toes, The tips of the toes, It's total, like a stream that flows into the space beyond. Feel the whole body at once, Each individual sensation melting into a mass of sensation, Awareness of the whole body at once And let awareness sink even deeper. Feel the skin And go beneath the skin, feeling the insulating tissues, The worm substances. And deeper still to feel muscles, Letting muscles give up their command of the body, Committing them to rest. And deeper still into bones And the layers inside the bones. I throw the bones themselves could sigh a little, Feeling the bones carried On the currents of breath. And deeper still to feel the soft organs in the contents of your skeleton, The heartbeat slowing down, All the organs committed to rest. Feel the fluids and waterways in the body, In the cells, humming, pulsing and glowing, just like stars against the night sky. Can you go deeper still and feel the energy Behind or underneath these Sensations? Now bring your attention to a sensation of heaviness, Welcoming the sensation of heaviness in some or all parts of the body, And bring your attention to a sensation of lightness. Are weightlessness in some or all parts of the body. Go back and forth, Returning attention to the sensation of heaviness. Give yourself up to heaviness, Relaxing into heaviness, And go back to the sensation of lightness or weightlessness. Give yourself up to lightness, Dissolving into weightlessness. Back to the sensation of heaviness- Arms and legs heavy and sinking, Ed and torso heavy and sinking. Back to the sensation of lightness. Arms and legs floaties and weightless. Head and torso floating in space so light, Now filled. both simultaneously. feel heavy and light at once. Don't try to think about this, just feel Heaviness and lightness dissolving into each other. Now notice what is your direct experience of the body now. Is it solid? Is there a center? Let the Body answer the question. Set your attention free to a feeling of just being Nothing. you need to do, Nothing. you need to know or get or want. Having let go of any set identity, time and space, Notice what remains. I'll let yourself fall back into the heart space, Emptying the minds completely. have any images, thoughts, Feeling, stories, Emptying completely Into the Heart space, Falling back into a deep, deep breast."
nan,nan,"This morning's meditation will be a guided practice, Shifting from the focus on breath and body To begin with another doorway of mindfulness: Attention to sound. Let yourself see it as, continue to sit As You Are, Saddled and steel And for this time, Bring your attention to the doorway of the year And begin to notice the Words As they arise And then they vanish, And notice As well The soft sounds in the room, Notice the sound of the bells that arise And relax into hearing, Allowing distant sounds to come and go. Bealls And, like the breath Which arises out of emptiness, Appears and then vanishes. Show to the sounds, appear, Experience for a moment And then Pass away. And as you listen, Relax, open, Let yourself sense or feel In any way you can That your mind is not limited to the size of your head. Feel, imagine, sense That your mind is vast, like the sky, Pegasus room and even Baker, Open and spacious, And the sounds that you hear, These words appearing and disappearing, The distance sounds, The soft sounds in the room, All rise and pass like clouds or bubbles, And the vast Sky of mind. No inside, no outside, Just open this Awareness itself. Last, like this guy, NM, distance Sounds appear and move through one dimension of the sky. Bealls Arise, Relax into vastness, Open this without any borders. Rest in the sky like nature of your own mind. Snow inside or outside, Words appear and disappear, Towns in the real arise and pass Like clouds, Like bubbles, Leaving no Trace To know the truth, Look directly into the nature of Mind itself, And it's true. State mind is transparent Fast. is the sky Timeless, Containing all things? It not limited by them? Wakefulness itself fewer Clear. Rest in the vast space And that each of the sounds appear Like a cloud And dissolve, Leaving the space open and empty, Silent. You left your eyes open since the vastness, with sites appearing within it, And let yourself also extend the Field of love to all those around you. You can even look around a little bit of the beings appearing in this Vastness and field of love."
nan,nan,"Macy's practice. awaken your inner wisdom. Life is a force that is beyond the Physical Realm of experience. it is a force that is deep within your vein, a powerful mystery that holds the key to your potential. self-belief can be the difference between success and failure. learning how to believe in yourself is to unlock the power of your bank, your consciousness. Find yourself a countable position for this practice. That's that by taking in some long date, breast Raising, Cane's Chicken, hours Breathing out through the nose. Resinize And app for the nose. Feel the sensation of your breath. Try and seal the expansion and relaxation of your lungs. Internalize your attention into the process of breathing. Are you pressed? for the next few moments, They spread to take you into a deep state of relaxation. Don't believe is a powerful tool that you can use to shift your energy into alignment with a potential experience. What do you want out of life? contemplate this question for the next few moments. Now i want you to believe that you can have it all. whatever your mind can conceive, you can. i tell you, Everything you want and desire is yours to manifest. all you have to do is believe in yourself. Why not you? you're amazing. you have unlimited potential. You are an expression of consciousness. The most ultimate realization in this life is to know that you are a spiritual pain going through a human experience. Do you have unlimited potential? you are a Creator and expression of consciousness. No one is better than you. you are not better than anyone. believe in your power. See yourself in a future experience and believe that this future is yours. Believe you have the power to succeed. Believe you have the power to inspire. Believe in yourself. Self belief is a powerful force that allows you to channel your energy into a new paradigm. AAA is a night expression of your consciousness. Believe in yourself so you can tackle lock with a 100% confidence and resilience. By holding a certain belief in your heart, your body moves into that reality. Your body doesn't know the difference between what's happening outside of you or what's happening within you. To create a reality you want to experience. believe in a future you want to manifest. Now i'm going to count down from 10 to 1 with h-town by countdown. i want you to throw your belated and love you have for yourself more and more. Finally, when I get to one, I want you to feel like you are the master of your universe. 10: believe in yourself. 9: you are a creator. Are there? age breath to bring you more belief. 7 grade in love and joy. Text: feel every cell in your body, come alive with stuff for life. V. you are an architect of your reality. Honesty, power of this moment. Trade, show your body, Live. we stop belief To ignite the power you have. date within your thing. Why, you are the master of your own universe. Yeah, repeat after me, I am the master of my universe. I am the master of my universe. I am the master of my universe."
