Meditation_Type,URL,Script
nan,nan,"Nobody likes pain, Rewind, wants to avoid pain. Sometimes pain is unavoidable as an experience in this life. It also has a subjective quality. When we experience pain, we tend to tense up And then we magnifying, concentrate on the pain and it gets worse. Today I don't work with the pain. What kind of work to help change your perception of how this feels We're going to begin? So get yourself as comfortably arranged as you possibly can: Couch, chair wherever it is you find yourself. maybe in a bit It's time to relax as much as you can. The try to take us off. deep breath in 3 hour nose And exhale through your mouth Another soft, deep breath in Through your nose. Exhale 3 air miles. Attention to your breathing. Relax your breathing as much as you can. Raining now, Raining in, Close your eyes. Begin to relax as much as you can. think about your eyes, eyelids, eye muscles. relax your eyelids and eye muscles now. make your eyelids comfortably pleasantly closed and relax. Now. allow those feelings of relaxation and your eyelids and eye muscles to multiply, to magnify, To become greater, Standing across your cheeks, your cheekbones, your cheek muscles, your jaw. Think about your job. relax your jaw. that's a place where tension and stress often gather, so be sure to relax your jaw, That's right. I'm not allow that relaxation to penetrate deep into the floor of your mouth. Might want to allow your lips to part a little bit. Jeffries, and more relaxation, Miniature exhale tension from today. Your Forehead now. relax your forehead, every muscle, every cell of your forehead, And then think about the area from your forehead up over top of your head down to the nape of your neck, and just relax your scalp muscles. But a man could do. you notice a little tingling. Your scalp is you? relax your scalp and then your neck muscles. think about the large and small muscles in your neck. relaxes muscles as much as you can. and then your shoulders, A large and small muscles. Relax your shoulders now. let them go. Allow that relaxation to begin to flow now from your shoulders down both of your arm, Cross your upper arms to your elbows, on your elbows down to your wrist. now across the backs, if your hands are phone Palms of your hands now all the way up to your fingertips. a good thing, you notice a little tingling in your hands and your palms and that's fine. Relax now those arms from your fingertips all the way up to your shoulders, making those arms of yours heavy, rested, relaxed, like the arms of a limp ragdoll. So heavy, so relax and relax. relax your arms, make them heavy, lamp, loose, lazy, heavy, heavier now. And there's your breathing now. imagine that relaxation moving across your chest, down through your abdomen, as much as you're able to have a feeling of comfort in your ad. Picture something soothing, something restful, perhaps like a black, dark, robust, soft, flowing velvet, slowly curling down around your shoulders, holding you secure, and as that road passes down your back, down your spine, Relaxing each and every muscle, cells and nerve and fire as it goes and flows to the whole Center of your body, coating each and every organ, was peace and love and healing standing as feelings. relaxation, now, as much as you're able to relax both eyes. imagine those thighs being like sponges, sponges absorbing liquid, nail sorbet, liquid becoming. have, Aaron earwood? relaxation down to your knees, all the way down to your lower legs, now to your ankles. Do your feet so that your whole body Rested. have a lamp now relax a more and more. Now it's time for you to double your relaxation: The top of your head to the tips of your fingers and toes, and a wave of relaxation all the way through the top of your head down to your feet and down to your toes. Gas now Region every breath that you take in. allow yourself to relax even more deeply and comfortably as you continue to focus on the sound of my voice. now, Every Breath You Take. only you know what relaxation feels like. only you can create it. Only you can remember what Comfort feels like. so let your body and every cell in your body, now I, remember what it feels like to be comfortable. Once you change your thinking in this way, you begin to rewire your brain to send out different chemicals To make changes in the body's responses. It's like The way of thinking about eating a lemon can make your jaw hurt. What causes change in the salivation? Imagine to yourself: I'm relaxed, now comfortable, I'm in control. What does relaxation, comfort and control look like? Call Dad, image your mind as I speak. With Every Breath You Take, Allow yourself to take control of comfort. i wondered if you could decide to create a coolness or a warm, Are soothing color in your body. You could see this discomfort is almost a kind of a benefit. You'll probably determine what you can create According to which gives you The larger benefits. And as I speak, and you create within your mind different thoughts and different images of how you want to feel. I need for you to know That your thoughts, through your thoughts, you're actually in control of your mind and body. therefore, the more you focus your thoughts on my voice, the more you'll have control over how comfortable you choose to be. I wonder if you might be able to be reminded of a time in your past when you were aware of how comfortable your body could be. Maybe even now you're beginning to notice heaviness, Or could be like this, in your body And I wonder how you feel. coldness or Warmness? Africanus, You know your own body better than anyone. I'm wondering if you might already begin to be noticing that your body is even a little more relaxed Now. Which way is more relaxed? Your left side of her there, your right side over here? Matt area, which of the pass was uncomfortable? is it close to you now or is it far away? Think about looking through binoculars. I wonder if you noticed, when you think of a place of discomfort, this like looking through binoculars. It could be there to get so big now. bigger clothes are almost as this, right up close, or yet You might think that you could turn those binoculars around. and how far, far, far away. Copy that feeling, Maybe even remember how it was when you were a child. Now imagine that area of discomfort shrinking, shrinking, becoming tiny, are tiny, are tinier. when you look at it in a different way, Can you look at a different way? you're looking at it a different way. And now I'd like for you to imagine Your feet now Cedar, like back in, And they begin to suck up and do your body, starting at the ankles and lower part of your legs and your knees and your thighs, every cell now filling with a cool, orange colored magnetic liquid, moving into your hips, your pelvic area and your abdomen, all the organs now, all the sales of your abdomen, and now flows into your lungs and do your chest. Imagine yourself breathing With your lungs filled with a cool orange colored magnetic liquid. Now Could be some areas of your body would be more pleasing if they were warm or maybe they were cool. Now, if there's a coolness in that area, it's okay to make them warm. That's right and you're doing well now Every breath. Allow me to drift gently and peacefully- End of this wonderful state of peace- At that chest continues to feel that warm or cool Orange colored liquid, magnetic liquid begins to flow over to your arms, your fingertips all the way up to your shoulders. now every cell, every vessel, every part of your body, now, from your neck down, feels with warm or cool orange colored liquid, magnetic liquid. Now, Cool, orange colored magnetic liquid filling your headgear, your ears, your eyes, are sinuses, your brain, And now I could be warm or coolness, this orange-colored magnetic liquid now already creating comfort and calmness. Why wouldn't it be okay To allow that magnetic orange liquid pool from every cell: anxiety, tension, comfort. You're worthy now allowing that comfort that comes from allowing this amazing orange colored magnetic liquid- cool, soothing liquid- to pull from every cell of your body: anxiety, tension, discomfort. you do have a right to be more comfortable. So now I allow every cell in your body to remember what normal feels like. Yes, Focus now on Happy memory, a comfortable memory of what normal feels like. Remember what it felt like in just one area of your body. Remember what normal, comfortable, happy feels like. Now imprint that memory on every cell of your body, Every cell of your body, and as you do so, that cool or warm orange colored magnetic liquid will continue to pull from every cell. anxiety, tension and discomfort said you can replace uncomfortable memories with memories of comfort, Serenity, peace, tranquility, and every cell Do that. now I'll be silent As you go deeper To relaxation, Freestyle, to be imprinted with the memory. What normal feels like? You doing so well, creating comfortable, calm, peaceful Feelings. Now Every cell of your body knows what normal is, How wonderful It feels to remember what comfort Normal and You have that right. It's okay to let go of negative emotions like guilt, She Doubt, Let It Go. Lower yourself to have forgiveness for yourself and for others. it doesn't mean you condone what was done. Play, break the chain that lets others control you And, most of all, it takes the pain out of the memory. I'll go back into that deep relaxation. You may be surprised at what happens now as you visualize the color fading away, getting lighter and lighter. Color Shift away to clear. It's soon time For you to emerge to higher level of the week 8.. But every time you see or sense of receive orange or the color orange, it brings back those feelings of peacefulness or calmness, relaxation, imprinting on the south of what normal feels like. And allow yourself to feel so calm, so peaceful now, Every cell of your body. what normal is? Yes, and now feeling a greater sense of light, Greater sense of peacefulness, A greater sense of self and well-being, Greater sense of peacefulness and relaxation, Even though you're alert and Away by yourself, to shift back up, Tell more awakened state of being more peaceful, more relaxed, though always remembering, firmly anchored, that memory of what normal is Coming back soon, now, as I count you back to 5. Your soul to take a moment to get ready. The number one Celebrity: i like you to see yourself. I could so see if you're swimming up through a pink waterfall and healing light and love all parts of you and your soul. now, Clint Hill, coming back As you should be in 3, seeing yourself actually surrounded by a protective Field of white light, Floating protection, Wi-Fi, Far. Allow yourself to emerge hands and feet more normalizing And when you're ready now, Coming back to waking consciousness, Feeling relieved, Shift To the way sayings Are normal, Why they should pay."
nan,nan,"This is a meditation on gratitude and joy. In tibet, the monks and nuns off of prayers of gratitude for the suffering they've been given. Grant that I might have enough suffering to Awakening me the deepest possible compassion and wisdom. The Taoist speak about life's ten thousand Joys and 10000 sorrows. The aim of spiritual life is to awaken a natural, joyful Freedom, a kind and Compassionate Heart in the face of everything. Gratitude is really an acknowledgement of everything that supports us About: of gratitude to our blessings, Appreciation of our Good Fortune, what supports us in our daily life. It's really An appreciation of life itself. As gratitude grows, it gives rise to, to Joy, Which is the natural expression of an open heart Appreciating the goodness around us, in others And in ourselves. Like gratitude, Joy gladdens the heart. We can be joyful for those who we love, The moments of happiness For the birds and animals in the trees, From the very Breath of Life that sustains us And has, joy deepens. we can discover a happiness that doesn't depend on conditions. We can be happy in life is self just, him being alive. Syphilis meditation: let yourself sit comfortably, IDs, Allow your body to be relaxed. Open a taste, your breast to be Natural, Your heart at ease, And begin this practice of gratitude by feeling l Throughout your life. you've cared for your own life And let yourself acknowledge all that is supported you in this life. I know they used some traditional phrases and you can reflect on these With gratitude. I remember the Beings and creatures, the plants, The Erin, the water, the sea in the Earth. All his efforts bless my life everyday. With gratitude, i remember the work in the labor of all the generations of ancestors who came before me. I offer gratitude for the safety and security and well-being that i've been given. I offer gratitude for the blessings of the earth that i've been given. I also gratitude for the, the measure of health that has been given to me. I off the gratitude for my family and my friends That I've been given. I offered my gratitude for the community that i've been given. I offer my gratitude for the teachings and practices that have supported me that i've been given. I offer my gratitude for the life that i've been given And you might just take a few moments to let the gratitude arise for anything else in your life that you appreciate and feel grateful for, And justice with grateful for all our own blessings so we can be grateful for the blessings of others. So continue to breathe in a relaxed and comfortable way And bring to mind somebody you care about, Somebody who you can feel Joy when you bring them into your mind and heart And picture them. Feel the natural Joy you have for that Goodness, The well-being, The happiness And with each brass, grateful, Heartfelt wish. May you be joyful, May your happiness increase. May you not be separated from great happiness. May your good fortune and the causes for your joy and happiness increase. Iub to iphone. May your happiness increase. May you not be separated from great happiness. May your good fortune and the causes for your joy and happiness increase. Feel the joy and the caring in each phrase. See if you can touch into the felt sense in the body And the Heart Just breathing into the phrases, and when you Feel ready, He might extend this practice to another person you care about. Recite the same phrases to express Your crotch itch you the joy of your heart. May you be joyful, May your happiness increase. May you not be separated from great happiness. Are you good fortune and the causes for your joy and happiness increase. And it's important in this meditation to not leave ourselves out of this. wishes Sao opening 2: our own Caring for this being for a selves Wishing happiness and joy, Feeling joy in our own happiness. VIP Choice phone Play. my happiness Increase. May I not be separated from great happiness. Hi, my good fortune and the causes for mike joy and happiness increase. Over these next minutes. he might gradually open the meditation to include others, include neutral people. we may not have strong feelings to always see the way, Difficult people. Until you extend appreciative joy to all beings everywhere, Young, old. Yeah, May you be joyful. May your happiness increase. May you not be separated from great happiness. May your good fortune And the causes for your joy and happiness increase. Allow yourself to feel in your body and your heart your happiness and joy at the well-being and happiness about those end of yourself. May you be joyful, May your happiness increase. May you not be separated from great happiness. Are you good fortune and the causes for your joy and happiness increase. Extending these wishes to all beings everywhere, male beings be joyful. May all beings Increasing happiness. May they not be separated from great happiness. Me that good fortune And the courses for that joy and happiness increase."
nan,nan,"Allow yourself to settle down comfortably numb When you are comfortable. Think about being supported When you become aware of how the chair is touching your back, or or how the bed is supporting your body, or just how the ground on the floor supporting you. Just allow your Isaac Coast now. If, at any time, you want to move to make yourself in more comfortable, you can do that because you are in control. Now take a deep breath And I will dance. And when you let it out slowly now, just let everybody relax. That's right. Just relax as far as you are comfortable And I'll take another deep breath. How old it Anime you let it out slowly now, All the tension in Europe. Just allow yourself to relax completely And when you are ready, take another deep breath And I will. When you let it out slowly now, And this time really let go. The breathing just flow now in your natural rhythm. The natural rise and fall of your breathing will automatically help you relax More And more. You can rest assured that your body knows how to do that for you And will continue to do so. now, After you listen to the sound of my voice, You may even find that whatever you hear from now on Only helps to relax you. I love your arms, legs and hands and had to go live with loose and floppy, Just like a rag doll, Bernachon, an old coat thrown across a chair. No wonder now you can begin with letting all the muscles in your face relax, Especially in your jaw. This is a place where attention sometimes gathers, so that your teeth are just a little bit. Feel relaxation moving into your temples And that's you. think about relaxing these muscles. They will relax. Feel them relax. unless they relax as you relax, You'll be able to just drift and flow into a deeper and deeper level of total relaxation, Letting your unconscious don't get any and every positive word- Or I did that I offer you. Why don't you just rip? And more, girl, The relaxation After you continue to relax That all of the muscles in your forehead relax. Feel those muscle smooth, smooth. I'm relaxed. You can rest your eyes. Just imagine your eyelids feeling so comfortable, So happy, So happy, So relax. Like an ice cube melting in warm water, Like the muscles diarrhea Around that, Behind the eyes, Bell, Relax. And now that all of the muscles in the back of your neck and shoulders relaxed, Feel like I'm letting go, As if a weight has been lifted off your shoulders And feel that soothing relaxation moving down Your back, Coming down, Down. Down Is the lower part of your back, Those muscles let go. Every Breath You Take, the love yourself Experience. Here and Now You can focus on the relative silence, Free the words, books In between the branches of a tree. Set up the tree itself, Looking at space, The shape of the states. We are the branches. Let go of all the muscles in your arms Running down From your shoulders Down through your elbows to your wrist. Now do your fingertips Relax, So beautiful. You can get a big surprise when the eldest Tingling sensation in their hands or fingertips Other people notice. I know the numbness, Happiness, Floating feeling And I don't know which arm Is heavier than the other, The other slider, The first. In your own way, Your own pace, A naturally relaxed- Imagine- feeling of pleasant wave of relaxation Slowing down through your chest Into your tummy, Relaxing all of the muscles in your stomach, Safe. With Every Breath You Take You can just feel yourself drifting Deeper And deeper into relaxation And it's good to know Your conscious mind Knows exactly The death: Relaxation. Are you right now, Kristoff, Do you listen? Style, We in the Sun Mention all of the muscles in your legs relax as you breathe down. relaxation down, Down, Through your hips, thighs, Ankles, Right way down to the tips of your toes. How very comfortable your body is feeling, Drifting and floating Into relaxation. Maybe there's Technic sensation in your feet or toes, Maybe there's a happiness or life. There's no right or wrong way to relax now. It's just your way. Heal your body drifting, Loading Down Deeper Down, deeper, At the total, Natural, Safe Relaxation. Your muscles go, Relaxing more and more. And while you're conscious mind, So where Some of the changes? You're unconscious, So we're of everything. Everything happens automatic inside of you, Safe, positive to know You're unconscious mind taking care of all those things, all the organs cooperating, All our moments, chemical reactions, The neurological signals- Automatically- It just happened, Just like relaxing App, Automatically And you're doing good. It's nice to begin to appreciate That you have a conscious mind And an unconscious mind And while you're conscious mind and to be aware of the feeling Or that foot Are the sounds of my words- Your conscious My Is aware of far more. Your conscious mind Is aware of everything And no And everything that I said ever happened to you, And your unconscious mind Also there's in a variety of ways, So you can really just let it Do the work for you for a while. Well, you just let go. That's right. that go, naturally, is the tree. let's go up to the eaves, That feeling Relaxation Blowing Rock Your Body, Wondering if that, at Weather Becoming heavier, The first Or which leg is shaking more deeply into relaxation Instead of the tree itself And the shape of the space In the space, Into relaxation Moving into your temples. Unless you think about relaxing these muscle, They will relax. It would be over at neighbor, lol. So get that Every positive word. Why don't you just read, As you continue to relax, That all of the muscles in your Feel, those muscle spoon How to relax. You can rest your eyes Matching your eyelids, feeling so ghosts, So happy, so happy, so relax. Like an ice cube melting in, Like the muscles of the eyes Around, eyes Behind the arras. No, Relax. And now that all of the muscles in the back of your neck and shoulders relaxed, Feel them letting go If a weight has been lifted off your shoulders, And feel that soothing relaxation moving down your back. Go back, Allow yourself Experience. And now Let go of all the muscles in your arms, Elbows. Tell me about when they notice Fingertips. Brad pitt Is heavier than the other And your own way, Your own pace, Safe. Imagine feeling a pleasant wave of relaxation slowing down through your chest. Adopt me, Relaxing all of the muscles in your stomach, Sick with Every Breath You Take. You can just be yourself Deeper into relaxation. Mention all of the muscles in your legs, Very comfortable if body is feeling. Take me to relaxation. There's Technics: installation, your feet, Toes, Your body. Relaxation, She's mine. Some of the changes, Conscious, The winner of that bread Care of all those six, All the aura Chemical, Automatically. Vera bradley And you are a couple So you can really Let go naturally. The other Have your, The first In the space Relaxation."
